{
  "type": "object",
  "properties": {
    "version": {
      "const": "1.0"
    },
    "project_id": {
      "type": "string",
      "minLength": 1,
      "pattern": "\\S"
    },
    "story_revision": {
      "type": "string",
      "minLength": 1,
      "pattern": "\\S"
    },
    "story": {
      "type": "object",
      "properties": {
        "desire": {
          "type": "string",
          "minLength": 1,
          "pattern": "\\S"
        },
        "action": {
          "type": "string",
          "minLength": 1,
          "pattern": "\\S"
        },
        "consequence": {
          "type": "string",
          "minLength": 1,
          "pattern": "\\S"
        },
        "payoff": {
          "type": "string",
          "minLength": 1,
          "pattern": "\\S"
        }
      },
      "required": [
        "desire",
        "action",
        "consequence",
        "payoff"
      ],
      "additionalProperties": false
    },
    "assets": {
      "type": "array",
      "items": {
        "$ref": "#/$defs/asset"
      },
      "minItems": 0,
      "uniqueItems": true
    },
    "project_review": {
      "$ref": "#/$defs/review"
    },
    "late_cast_ids": {
      "type": "array",
      "items": {
        "type": "string",
        "minLength": 1,
        "pattern": "\\S"
      },
      "minItems": 0,
      "uniqueItems": true
    },
    "payoff_speaker_ids": {
      "type": "array",
      "items": {
        "type": "string",
        "minLength": 1,
        "pattern": "\\S"
      },
      "minItems": 0,
      "uniqueItems": true
    },
    "payoff_asset_id": {
      "type": "string",
      "minLength": 1,
      "pattern": "\\S"
    },
    "shots": {
      "type": "array",
      "items": {
        "$ref": "#/$defs/shot"
      },
      "minItems": 1,
      "uniqueItems": true
    },
    "reference_mode": {
      "enum": [
        "reference_free",
        "reference_guided",
        "frame_conditioned"
      ],
      "description": "Explicit reference_free is text-only; reference_guided uses reviewed boards as targets and separate native references, without temporal frame pins. Absence retains literal boarded prerequisites. Explicit shot_local_v1 frame_conditioned uses one declared/current observed starting composition; optional end/payoff targets stay semantic evidence."
    },
    "planning_mode": {
      "const": "shot_local_v1",
      "description": "Prospective shot-local eligibility. Absence retains immutable legacy whole-plan bindings."
    }
  },
  "required": [
    "version",
    "project_id",
    "story_revision",
    "story",
    "assets",
    "project_review",
    "late_cast_ids",
    "payoff_speaker_ids",
    "shots"
  ],
  "additionalProperties": false,
  "$schema": "https://json-schema.org/draft/2020-12/schema",
  "$id": "https://openmontage.local/artifacts/shot_contract",
  "title": "Shot Contract",
  "description": "Current version 1.0. Authored semantic evidence; structural validation alone never authorizes motion. Legacy scene plans remain readable without this sidecar.",
  "$defs": {
    "predicate": {
      "type": "object",
      "properties": {
        "name": {
          "type": "string",
          "minLength": 1,
          "pattern": "\\S"
        },
        "status": {
          "enum": [
            "pass",
            "fail",
            "unknown"
          ]
        },
        "evidence": {
          "type": "string",
          "minLength": 1,
          "pattern": "\\S"
        },
        "severity": {
          "enum": [
            "critical",
            "cosmetic"
          ]
        }
      },
      "required": [
        "name",
        "status",
        "evidence"
      ],
      "additionalProperties": false
    },
    "review": {
      "type": "object",
      "properties": {
        "review_id": {
          "type": "string",
          "minLength": 1,
          "pattern": "\\S"
        },
        "reviewer": {
          "type": "string",
          "minLength": 1,
          "pattern": "\\S"
        },
        "story_revision": {
          "type": "string",
          "minLength": 1,
          "pattern": "\\S"
        },
        "subject_sha256": {
          "type": "string",
          "pattern": "^[a-f0-9]{64}$"
        },
        "status": {
          "enum": [
            "pass",
            "fail",
            "unknown",
            "provisional"
          ]
        },
        "predicates": {
          "type": "array",
          "items": {
            "$ref": "#/$defs/predicate"
          },
          "minItems": 1,
          "uniqueItems": true
        },
        "draft_policy_sha256": {
          "type": "string",
          "pattern": "^[a-f0-9]{64}$"
        },
        "creator_draft_exception": {
          "type": "object",
          "additionalProperties": false,
          "required": [
            "path",
            "sha256"
          ],
          "properties": {
            "path": {
              "type": "string",
              "minLength": 1
            },
            "sha256": {
              "type": "string",
              "pattern": "^[a-f0-9]{64}$"
            }
          }
        }
      },
      "required": [
        "review_id",
        "reviewer",
        "story_revision",
        "subject_sha256",
        "status",
        "predicates"
      ],
      "additionalProperties": false,
      "allOf": [
        {
          "if": {
            "properties": {
              "status": {
                "const": "provisional"
              }
            }
          },
          "then": {
            "anyOf": [
              {
                "required": [
                  "draft_policy_sha256"
                ]
              },
              {
                "required": [
                  "creator_draft_exception"
                ]
              }
            ]
          },
          "else": {
            "not": {
              "anyOf": [
                {
                  "required": [
                    "draft_policy_sha256"
                  ]
                },
                {
                  "required": [
                    "creator_draft_exception"
                  ]
                }
              ]
            }
          }
        }
      ]
    },
    "asset": {
      "type": "object",
      "properties": {
        "id": {
          "type": "string",
          "minLength": 1,
          "pattern": "\\S"
        },
        "role": {
          "enum": [
            "identity_reference",
            "start_frame",
            "end_frame",
            "timed_keyframe",
            "payoff_board",
            "observed_outgoing_frame",
            "voice_reference",
            "reference_image",
            "reference_video",
            "reference_audio"
          ]
        },
        "path": {
          "type": "string",
          "minLength": 1,
          "pattern": "\\S"
        },
        "sha256": {
          "type": "string",
          "pattern": "^[a-f0-9]{64}$"
        },
        "cast_ids": {
          "type": "array",
          "items": {
            "type": "string",
            "minLength": 1,
            "pattern": "\\S"
          },
          "minItems": 0,
          "uniqueItems": true
        },
        "review": {
          "$ref": "#/$defs/review"
        },
        "time_seconds": {
          "type": "number",
          "minimum": 0
        },
        "upstream_source": {
          "type": "object",
          "required": [
            "shot_id",
            "role"
          ],
          "properties": {
            "shot_id": {
              "type": "string",
              "minLength": 1
            },
            "role": {
              "const": "outgoing_frame"
            }
          },
          "additionalProperties": false
        },
        "preparation_pending": {
          "const": true,
          "description": "Declared prospective board slot; no source bytes or verdict exist yet."
        }
      },
      "required": [
        "id",
        "role",
        "cast_ids"
      ],
      "additionalProperties": false,
      "allOf": [
        {
          "if": {
            "required": [
              "upstream_source"
            ]
          },
          "then": {},
          "else": {
            "if": {
              "required": [
                "preparation_pending"
              ]
            },
            "then": {
              "not": {
                "anyOf": [
                  {
                    "required": [
                      "path"
                    ]
                  },
                  {
                    "required": [
                      "sha256"
                    ]
                  },
                  {
                    "required": [
                      "review"
                    ]
                  }
                ]
              }
            },
            "else": {
              "required": [
                "path",
                "sha256",
                "review"
              ]
            }
          }
        }
      ]
    },
    "transition": {
      "type": "object",
      "properties": {
        "type": {
          "enum": [
            "continuous",
            "location_cut",
            "time_cut",
            "reaction_cut",
            "insert_cut",
            "transformation",
            "hard_cut",
            "match_cut"
          ]
        },
        "rationale": {
          "type": "string",
          "minLength": 1,
          "pattern": "\\S"
        },
        "transformation_id": {
          "type": "string",
          "minLength": 1,
          "pattern": "\\S"
        }
      },
      "required": [
        "type",
        "rationale"
      ],
      "additionalProperties": false
    },
    "dialogue": {
      "type": "object",
      "properties": {
        "speaker_id": {
          "type": "string",
          "minLength": 1,
          "pattern": "\\S"
        },
        "source": {
          "enum": [
            "visible",
            "offscreen"
          ]
        },
        "text": {
          "type": "string",
          "minLength": 1,
          "pattern": "\\S"
        },
        "start_seconds": {
          "type": "number",
          "minimum": 0
        },
        "end_seconds": {
          "type": "number",
          "exclusiveMinimum": 0
        }
      },
      "required": [
        "speaker_id",
        "source",
        "text",
        "start_seconds",
        "end_seconds"
      ],
      "additionalProperties": false
    },
    "transformation": {
      "type": "object",
      "properties": {
        "id": {
          "type": "string",
          "minLength": 1,
          "pattern": "\\S"
        },
        "description": {
          "type": "string",
          "minLength": 1,
          "pattern": "\\S"
        },
        "preserved_invariants": {
          "type": "array",
          "items": {
            "type": "string",
            "minLength": 1,
            "pattern": "\\S"
          },
          "minItems": 1,
          "uniqueItems": true
        }
      },
      "required": [
        "id",
        "description",
        "preserved_invariants"
      ],
      "additionalProperties": false
    },
    "upstream": {
      "type": "object",
      "properties": {
        "shot_id": {
          "type": "string",
          "minLength": 1,
          "pattern": "\\S"
        },
        "attempt_id": {
          "type": "string",
          "minLength": 1,
          "pattern": "\\S"
        },
        "output_sha256": {
          "type": "string",
          "pattern": "^[a-f0-9]{64}$"
        },
        "outgoing_frame_sha256": {
          "type": "string",
          "pattern": "^[a-f0-9]{64}$"
        },
        "review_sha256": {
          "type": "string",
          "pattern": "^[a-f0-9]{64}$"
        }
      },
      "required": [
        "shot_id"
      ],
      "additionalProperties": false,
      "anyOf": [
        {
          "maxProperties": 1
        },
        {
          "required": [
            "attempt_id",
            "output_sha256",
            "outgoing_frame_sha256",
            "review_sha256"
          ]
        }
      ]
    },
    "shot": {
      "type": "object",
      "properties": {
        "reference_mode": {
          "enum": [
            "reference_free",
            "reference_guided",
            "frame_conditioned"
          ]
        },
        "id": {
          "type": "string",
          "minLength": 1,
          "pattern": "\\S"
        },
        "initial_state": {
          "type": "string",
          "minLength": 1,
          "pattern": "\\S"
        },
        "dominant_action": {
          "type": "string",
          "minLength": 1,
          "pattern": "\\S"
        },
        "completed_end_state": {
          "type": "string",
          "minLength": 1,
          "pattern": "\\S"
        },
        "endpoint_completion": {
          "enum": [
            "completed",
            "partial",
            "unknown"
          ]
        },
        "duration_seconds": {
          "type": "number",
          "exclusiveMinimum": 0
        },
        "cast_ids": {
          "type": "array",
          "items": {
            "type": "string",
            "minLength": 1,
            "pattern": "\\S"
          },
          "minItems": 0,
          "uniqueItems": true
        },
        "required_visible_speakers": {
          "type": "array",
          "items": {
            "type": "string",
            "minLength": 1,
            "pattern": "\\S"
          },
          "minItems": 0,
          "uniqueItems": true
        },
        "dialogue": {
          "type": "array",
          "items": {
            "$ref": "#/$defs/dialogue"
          },
          "minItems": 0,
          "uniqueItems": true
        },
        "prop_body_invariants": {
          "type": "array",
          "items": {
            "type": "string",
            "minLength": 1,
            "pattern": "\\S"
          },
          "minItems": 1,
          "uniqueItems": true
        },
        "allowed_transformations": {
          "type": "array",
          "items": {
            "$ref": "#/$defs/transformation"
          },
          "minItems": 0,
          "uniqueItems": true
        },
        "transition": {
          "$ref": "#/$defs/transition"
        },
        "asset_ids": {
          "type": "array",
          "items": {
            "type": "string",
            "minLength": 1,
            "pattern": "\\S"
          },
          "minItems": 0,
          "uniqueItems": true
        },
        "review": {
          "$ref": "#/$defs/review"
        },
        "upstream": {
          "type": "array",
          "items": {
            "$ref": "#/$defs/upstream"
          },
          "minItems": 0,
          "uniqueItems": true
        },
        "frame_input": {
          "type": "object",
          "required": [
            "asset_id",
            "role"
          ],
          "properties": {
            "asset_id": {
              "type": "string",
              "minLength": 1
            },
            "role": {
              "const": "start_frame"
            }
          },
          "additionalProperties": false
        }
      },
      "required": [
        "id",
        "initial_state",
        "dominant_action",
        "completed_end_state",
        "endpoint_completion",
        "duration_seconds",
        "cast_ids",
        "required_visible_speakers",
        "dialogue",
        "prop_body_invariants",
        "allowed_transformations",
        "transition",
        "asset_ids",
        "upstream"
      ],
      "additionalProperties": false
    }
  },
  "allOf": [
    {
      "if": {
        "required": [
          "reference_mode"
        ],
        "properties": {
          "reference_mode": {
            "const": "reference_free"
          }
        }
      },
      "then": {
        "properties": {
          "assets": {
            "maxItems": 0
          },
          "late_cast_ids": {
            "maxItems": 0
          },
          "payoff_speaker_ids": {
            "maxItems": 0
          },
          "shots": {
            "items": {
              "properties": {
                "cast_ids": {
                  "maxItems": 0
                },
                "required_visible_speakers": {
                  "maxItems": 0
                },
                "dialogue": {
                  "maxItems": 0
                },
                "asset_ids": {
                  "maxItems": 0
                },
                "upstream": {
                  "maxItems": 0
                }
              }
            }
          }
        },
        "not": {
          "required": [
            "payoff_asset_id"
          ]
        }
      },
      "else": {
        "required": [
          "payoff_asset_id"
        ],
        "properties": {
          "assets": {
            "minItems": 1
          },
          "shots": {
            "items": {
              "if": {
                "required": [
                  "reference_mode"
                ],
                "properties": {
                  "reference_mode": {
                    "const": "reference_free"
                  }
                }
              },
              "then": {
                "properties": {
                  "cast_ids": {
                    "maxItems": 0
                  },
                  "required_visible_speakers": {
                    "maxItems": 0
                  },
                  "dialogue": {
                    "maxItems": 0
                  },
                  "asset_ids": {
                    "maxItems": 0
                  },
                  "upstream": {
                    "maxItems": 0
                  }
                }
              },
              "else": {
                "properties": {
                  "asset_ids": {
                    "minItems": 1
                  }
                }
              }
            }
          }
        }
      }
    },
    {
      "if": {
        "properties": {
          "assets": {
            "contains": {
              "required": [
                "preparation_pending"
              ]
            }
          }
        }
      },
      "then": {
        "required": [
          "planning_mode"
        ]
      }
    }
  ]
}
